{
  "schemaVersion": 1,
  "project": "example-astro-site",
  "updatedAt": "2026-08-11T00:00:00.000Z",
  "checks": [
    {
      "id": "frost-glass-contrast",
      "title": "Glassmorphism / frosted panel text contrast (WCAG 1.4.3)",
      "outcome": "untested",
      "severity": "serious",
      "tester": "replace-with-tester",
      "testedAt": null,
      "expiresAt": null,
      "environment": "Supported OS and browser; sample frosted panels over light and dark hero/media backgrounds",
      "routeOrScene": "home",
      "standards": [
        {
          "document": "WCAG-2.2",
          "requirement": "1.4.3",
          "level": "AA",
          "mapping": "conformance"
        }
      ],
      "evidence": "",
      "notes": "Glass/frost (backdrop-filter, translucent rgba) often yields axe color-contrast cantTell. Keep the visual language; verify AA contrast for text and essential icons on each frost surface. Prefer stronger frost opacity, text-shadow, or solid underlays under text — not removing glass entirely.",
      "remediation": "Adjust frost opacity/tokens until AA passes a contrast sampler; record sampler method, routes, and screenshots in evidence; then add a bounded suppression with outcomes [\"cantTell\"] for axe/color-contrast on affected routes.",
      "tags": [
        "glassmorphism",
        "frost-ui",
        "color-contrast"
      ]
    }
  ]
}
